,ID,World,Date,Important Trigger,Death,Description,Characters
,344,Jonas,27-06-1921,TRUE,FALSE,Adult Magnus and adult Franziska face the god particle and await the end of the cycle.,"Magnus Nielsen (J), Franziska Doppler (J)"
,345,Jonas,27-06-2020,TRUE,FALSE,The apocalypse erupts in Winden.,
,346,Jonas,22-09-2020,FALSE,FALSE,"Adult Peter and teen Elisabeth look for Charlotte and Franziska among the bodies. Since they are not there, they assume they are alive and have traveled.","Peter Doppler (J), Elisabeth Doppler (J)"
,347,Jonas,22-09-2020,FALSE,FALSE,Adult Peter and teen Elisabeth meet teen Noah. he says that he will protect Elisabeth even after Peter is killed.,"Peter Doppler (J), Elisabeth Doppler (J), Noah / Hanno Tauber (J)"
,348,Jonas,22-09-2020,FALSE,FALSE,Teen Elisabeth asks adult Peter for the notebook.,"Peter Doppler (J), Elisabeth Doppler (J)"
,349,Jonas,22-09-2020,FALSE,FALSE,Adult Claudia takes care of adult Regina.,"Claudia Tiedemann (J), Regina Tiedemann (J)"
,350,Jonas,22-09-2020,FALSE,FALSE,Adult Claudia prepares a family tree in the bunker and records her discoveries about the god particle.,Claudia Tiedemann (J)
,351,Jonas,22-09-2020,TRUE,FALSE,"Old claudia asks adult Tronte to kill adult Regina, so adult Claudia can move heaven and earth to prevent it.","Claudia Tiedemann (J), Tronte Nielsen (J)"
,352,Jonas,22-09-2020,FALSE,TRUE,"Old Tronte kills adult Regina because ""she said it's the only way to save you"".","Regina Tiedemann (J), Tronte Nielsen (J)"
,353,Jonas,22-09-2020,FALSE,FALSE,Adult Claudia finds adult Regina dead.,"Claudia Tiedemann (J), Regina Tiedemann (J)"
,354,Jonas,23-09-2020,FALSE,FALSE,Adult Claudia buries adult Regina.,"Claudia Tiedemann (J), Regina Tiedemann (J)"
,355,Jonas,25-09-2020,FALSE,FALSE,Adult Claudia (Martha's world) asks adult Claudia (Jonas' world) to join the light side (Eve) instead of the shadow side (Adam).,"Claudia Tiedemann (J), Claudia Tiedemann (M)"
,356,Jonas,25-09-2020,FALSE,FALSE,"She explains the meaning of the three cycles:

- teen Jonas opened the passage in 2020
- adult Jonas had previously shut in 2019
- the passage was opened in summer 1986 for the first time

in all three moments, they left behind traces of cesium residue. In every cycle, at each of these three moments, the cesium is carried throught the tunnel and back before it's completely decayed.

It exponentially expands endlessly, so it creates the passage.","Claudia Tiedemann (J), Claudia Tiedemann (M)"
,357,Jonas,25-09-2020,FALSE,FALSE,Everything has to happen again. They must keep the loop.,"Claudia Tiedemann (J), Claudia Tiedemann (M)"
,358,Jonas,25-09-2020,FALSE,FALSE,Adult claudia (Martha's world) gives adult Claudia (Jonas' world) the notebook and explains that she need lead everybody along the same path. She need the mantain the knot.,"Claudia Tiedemann (J), Claudia Tiedemann (M)"
,359,Jonas,25-09-2020,FALSE,FALSE,Adult Claudia uses her time machine.,Claudia Tiedemann (M)
,360,Jonas,25-09-2020,FALSE,FALSE,Adult Claudia reads the notebook.,Claudia Tiedemann (J)
,361,Jonas,25-09-2020,FALSE,FALSE,"Teen Elisabeth returns to the trailer alone and finds a burglar there. He attacks her, ties her up, and tries to rape her.",Elisabeth Doppler (J)
,362,Jonas,25-09-2020,FALSE,TRUE,Adult Peter surprises him. A fight ensues and Peter is killed.,"Peter Doppler (J), Elisabeth Doppler (J)"
,363,Jonas,25-09-2020,FALSE,TRUE,Teen Elisabeth manages to free herself and kills the burglar with a fire extinguisher.,Elisabeth Doppler (J)
,364,Jonas,25-09-2020,FALSE,FALSE,"Utterly distraught, she goes to the caves and teen Noah finds her.","Elisabeth Doppler (J), Noah / Hanno Tauber (J)"
,365,Jonas,26-09-2020,FALSE,FALSE,Adult Claudia goes to the power plant and sees the god particle.,Claudia Tiedemann (J)
,366,Jonas,26-09-2020,FALSE,FALSE,Jonas appears. He is trying to figure out a way for the god particle to work.,"Claudia Tiedemann (J), Jonas Kahnwald / Adam (J)"
,367,Jonas,26-09-2020,FALSE,FALSE,Adult Claudia tells him that she still has the time machine but its broken.,"Claudia Tiedemann (J), Jonas Kahnwald / Adam (J)"
,368,Jonas,26-09-2020,FALSE,FALSE,"Jonas doesn't trust adult Claudia. To convince him, she says that she can help him saving Martha.","Claudia Tiedemann (J), Jonas Kahnwald / Adam (J)"
,369,Jonas,01-01-2021,FALSE,FALSE,"Teen Elisabeth and teen Noah discover the door that reads ""Sic mundus creatus est"", but the time travel is closed.","Elisabeth Doppler (J), Noah / Hanno Tauber (J)"
,370,Jonas,01-01-2021,FALSE,FALSE,Teen Noah consoles teen Elisabeth by talking about the paradise promised by Adam.,"Elisabeth Doppler (J), Noah / Hanno Tauber (J)"
,371,Jonas,01-01-2023,FALSE,FALSE,Teen Jonas and adult Claudia  try to make the god particle work without success.,"Jonas Kahnwald / Adam (J), Claudia Tiedemann (J)"
,372,Jonas,01-01-2023,FALSE,FALSE,Teen Jonas can't take it anymore and tries to hang himself.,Jonas Kahnwald / Adam (J)
,373,Jonas,01-01-2023,FALSE,FALSE,Teen Noah saves him and reminds him that he cannot die because his future version already exists. This is the start of a friendship between them.,"Jonas Kahnwald / Adam (J), Noah / Hanno Tauber (J)"
,374,Jonas,01-01-2023,FALSE,FALSE,Teen Noah tells him that they have found the passage and reminds him that he must keep his promise.,"Jonas Kahnwald / Adam (J), Noah / Hanno Tauber (J)"
,375,Jonas,01-01-2040,FALSE,FALSE,"Adult Jonas, adult Noah, and old Claudia work on stabilizing the time travel portal.","Jonas Kahnwald / Adam (J), Noah / Hanno Tauber (J), Claudia Tiedemann (J)"
,376,Jonas,01-01-2040,FALSE,FALSE,Adult jonas tells that he changed the component in the passage and he thinks this time will be different.,"Jonas Kahnwald / Adam (J), Noah / Hanno Tauber (J)"
,377,Jonas,01-01-2040,FALSE,FALSE,"They spend decades working on the project, leading Noah to doubt Claudia's efforts. He believes she is sabotaging her own work.","Jonas Kahnwald / Adam (J), Noah / Hanno Tauber (J)"
,378,Jonas,01-01-2040,FALSE,FALSE,"Old claudia (Martha's world) reminds old Claudia (Jonas' world), that she must guide Jonas on his path.","Claudia Tiedemann (M), Claudia Tiedemann (J)"
,379,Jonas,01-01-2040,FALSE,FALSE,"Old claudia (Jonas' world) remembers what her older version said:  ""If all of this works, our Regina will live."" Then, why does she need to suffer endlessly?","Claudia Tiedemann (M), Claudia Tiedemann (J)"
,380,Jonas,01-01-2040,FALSE,TRUE,"Old claudia (Jonas' world), doesn't trust Eve anymore and kills old Claudia (Martha's world).","Claudia Tiedemann (J), Claudia Tiedemann (M)"
,381,Jonas,01-01-2040,FALSE,FALSE,Old claudia (Jonas' world) steals old Claudia's (Martha's world) time machine and impersonates her identity.,"Claudia Tiedemann (J), Claudia Tiedemann (M)"
,382,Jonas,01-01-2041,FALSE,FALSE,Adult Charlotte and adult Elisabeth arrive to 2041.,"Charlotte Doppler (J), Elisabeth Doppler (J)"
,383,Jonas,01-01-2041,FALSE,FALSE,They take little Charlotte to bring her to H.G. Tannhaus.,"Charlotte Doppler (J), Elisabeth Doppler (J)"
,384,Jonas,01-01-2041,FALSE,FALSE,Adult Noah and adult Elisabeth realize that Charlotte has disappeared.,"Noah / Hanno Tauber (J), Elisabeth Doppler (J), Charlotte Doppler (J)"
,385,Jonas,01-01-2041,FALSE,FALSE,Adult Noah threatens adult Jonas but he doesn't know where Charlotte is.,"Noah / Hanno Tauber (J), Jonas Kahnwald / Adam (J)"
,386,Jonas,01-01-2041,FALSE,FALSE,Noah grabs the notebook and vows to find Charlotte.,Noah / Hanno Tauber (J)
,387,Jonas,01-01-2041,FALSE,FALSE,"After decades of failed attempts, adult Jonas and old Claudia succeed in building a time travel portal in the ruins of the power plant.","Jonas Kahnwald / Adam (J), Claudia Tiedemann (J)"
,388,Jonas,21-06-1986,TRUE,FALSE,An explosion at the power plant causes the leak of radioactive material.,
,389,Jonas,21-06-1986,FALSE,FALSE,Old Bernd covers it up and puts the resulting radioactive waste in yellow barrels hidden in a cave.,Bernd Doppler (J)
,390,Jonas,21-06-1986,FALSE,FALSE,The explosion opens the portal in the passage.,
,391,Jonas,21-06-1986,TRUE,FALSE,Adult Noah and adult Helge start kidnapping children in order to test the chair machine.,"Noah / Hanno Tauber (J), Helge Doppler (J)"
,392,Jonas,09-10-1986,FALSE,FALSE,Young Katharina and young Ulrich bind young Regina to a tree.,"Katharina Nielsen (J), Ulrich Nielsen (J), Regina Tiedemann (J)"
,393,Jonas,09-10-1986,FALSE,FALSE,Mads accompanies Regina to her house and gets lost in the woods.,"Mads Nielsen (J), Regina Tiedemann (J)"
,394,Jonas,09-10-1986,FALSE,FALSE,Mads Nielsen goes missing.,Mads Nielsen (J)
,395,Jonas,04-11-1986,FALSE,TRUE,Mad's attempt to travel with Noah's machine.,"Mads Nielsen (J), Helge Doppler (J)"
,396,Jonas,05-11-1986,FALSE,TRUE,"Erik is transported to 1953 through the chair, but dies in the process.","Erik Obendorf (J), Helge Doppler (J)"
,397,Jonas,05-11-1986,FALSE,FALSE,Claudia is given Tannhaus's book about time travel by Helge.,"Claudia Tiedemann (J), Helge Doppler (J)"
,398,Jonas,05-11-1986,FALSE,FALSE,It is Claudia's first day running the power plant.,Claudia Tiedemann (J)
,399,Jonas,05-11-1986,FALSE,FALSE,Old Bernd shows adult Claudia the radioactive waste in the caves.,"Claudia Tiedemann (J), Bernd Doppler (J)"
,400,Jonas,05-11-1986,FALSE,FALSE,"A shepherd shows Egon 33 dead sheep. It seems that now he is a believer, because a new priest has come to Winden.",Egon Tiedemann (J)
,401,Jonas,05-11-1986,FALSE,FALSE,Mikkel travels throught the caves to 1986.,Mikkel Nielsen / Michael Kahnwald (J)
,402,Jonas,05-11-1986,FALSE,FALSE,Mikkel goes to the police and Egon takes him to the hospital,"Mikkel Nielsen / Michael Kahnwald (J), Egon Tiedemann (J)"
,403,Jonas,07-11-1986,FALSE,FALSE,Adult Claudia confronts old Bernd about the summer's accident.,"Claudia Tiedemann (J), Bernd Doppler (J)"
,404,Jonas,07-11-1986,FALSE,FALSE,Teen Hannah accuses Ulrich of raping Katharina.,Hannah Kahnwald (J)
,405,Jonas,07-11-1986,FALSE,FALSE,Ulrich is arrested on charges of raping Katharina.,Ulrich Nielsen (J)
,406,Jonas,07-11-1986,FALSE,FALSE,Adult Noah visits Mikkel at the hospital.,"Mikkel Nielsen / Michael Kahnwald (J), Noah / Hanno Tauber (J)"
,407,Jonas,07-11-1986,FALSE,FALSE,Child Mikkel/Michael and teen Hannah formally meet at the hospital.,"Mikkel Nielsen / Michael Kahnwald (J), Hannah Kahnwald (J)"
,408,Jonas,07-11-1986,FALSE,FALSE,The stranger arrives from 2019 to visit old H.G. Tannhaus and asks him to fix the machine so he can destroy the wormhole.,"Jonas Kahnwald / Adam (J), H.G. Tannhaus"
,409,Jonas,08-11-1986,FALSE,TRUE,"Yasin is transported to 1953 through the chair, but dies in the process.","Yasin Friese (J), Helge Doppler (J)"
,410,Jonas,06-11-2019,FALSE,FALSE,Yasin Friese disappears in the woods.,"Yasin Friese (J), Helge Doppler (J)"
,411,Jonas,08-11-1986,FALSE,FALSE,Young Jonas arrives from 2019.,Jonas Kahnwald / Adam (J)
,412,Jonas,09-11-1986,FALSE,FALSE,Old Egon questions teen Katharina.,"Egon Tiedemann (J), Katharina Nielsen (J)"
,413,Jonas,09-11-1986,FALSE,FALSE,Adult Ines adopts child Mikkel/Michael.,"Mikkel Nielsen / Michael Kahnwald (J), Ines Kahnwald (J)"
,414,Jonas,09-11-1986,FALSE,FALSE,Young Jonas finds Mikkel at the hospital.,"Mikkel Nielsen / Michael Kahnwald (J), Jonas Kahnwald / Adam (J)"
,415,Jonas,09-11-1986,TRUE,FALSE,"Jona encounters his older self, who tells him no to interfere.",Jonas Kahnwald / Adam (J)
,416,Jonas,09-11-1986,FALSE,FALSE,Jonas goes back to 2019.,Jonas Kahnwald / Adam (J)
,417,Jonas,09-11-1986,FALSE,FALSE,Egon writes on his police notebook that Helge drove down the long way on the night Mads goes missing.,Egon Tiedemann (J)
,418,Jonas,10-11-1986,FALSE,FALSE,H.G. Tannhaus teaches the stranger about time travel.,"H.G. Tannhaus, Jonas Kahnwald / Adam (J)"
,419,Jonas,11-11-1986,FALSE,FALSE,Teen Hannah tells Teen Katharina that Teen Regina was the false witness to the rape.,"Hannah Kahnwald (J), Katharina Nielsen (J)"
,420,Jonas,11-11-1986,FALSE,FALSE,Teen Ulrich is released from prison.,Ulrich Nielsen (J)
,421,Jonas,11-11-1986,FALSE,FALSE,Teen Aleksander rescues teen Regina from teen Katharina and teen Ulrich.,"Aleksander Tiedemann / Boris Niewald (J), Regina Tiedemann (J), Ulrich Nielsen (J), Katharina Nielsen (J)"
,422,Jonas,11-11-1986,FALSE,FALSE,Adult Claudia hires Teen Aleksander to weld the door between the power plant and the caves shut.,"Claudia Tiedemann (J), Aleksander Tiedemann / Boris Niewald (J)"
,423,Jonas,11-11-1986,FALSE,FALSE,Teen Boris Niewald arrives in Winden and adopts the identity of Aleksander Köhler.,Aleksander Tiedemann / Boris Niewald (J)
,424,Jonas,11-11-1986,FALSE,FALSE,Hannah found the hidden bag of Boris with the gun and the fake passport.,Hannah Kahnwald (J)
,425,Jonas,11-11-2019,FALSE,FALSE,Hannah blackmails Aleksander Tiedemann since she has proof he is an imposter.,"Hannah Kahnwald (J), Aleksander Tiedemann / Boris Niewald (J)"
,426,Jonas,11-11-1986,FALSE,FALSE,Elder Helge arrives from 2019.,Helge Doppler (J)
,427,Jonas,11-11-1986,FALSE,FALSE,Elder Helge tries to stop adult Helge but he runs away.,Helge Doppler (J)
,428,Jonas,11-11-1986,FALSE,FALSE,Claudia finds Gretchen on the caves.,"Claudia Tiedemann (J), gretchen"
,429,Jonas,12-11-1986,FALSE,TRUE,"Old Helge attempts to kill adult Helge in a car accident, but adult Helge survives and Old Helge dies.",Helge Doppler (J)
,430,Jonas,12-11-1986,FALSE,FALSE,Adult Helge goes to the psychiatric hospital.,Helge Doppler (J)
,431,Jonas,12-11-1986,FALSE,FALSE,Adult Jonas returns to Old H.G. Tannhaus' shop and picks up the finished time machine.,"Jonas Kahnwald / Adam (J), H.G. Tannhaus"
,432,Jonas,12-11-1986,FALSE,FALSE,Jonas arrives from 2019.,Jonas Kahnwald / Adam (J)
,433,Jonas,12-11-1986,FALSE,FALSE,Jonas goes to the hospital but is stopped by Noah and adult Helge.,"Jonas Kahnwald / Adam (J), Noah / Hanno Tauber (J), Helge Doppler (J)"
,434,Jonas,12-11-1986,FALSE,FALSE,Jonas wakes up in the bunker and his future self reveals his true identity.,Jonas Kahnwald / Adam (J)
,435,Jonas,12-11-1986,FALSE,FALSE,Adult Jonas fails to destroy the passage but he succeeds in closing it.,Jonas Kahnwald / Adam (J)
,436,Jonas,12-11-1986,TRUE,FALSE,The time portal opens over Winden.,
,437,Jonas,12-11-1986,FALSE,FALSE,Jonas touches little Helge through the portal and travels to 2052.,"Jonas Kahnwald / Adam (J), Helge Doppler (J)"
,438,Jonas,12-11-1986,FALSE,FALSE,Child Helge arrives to 1986 through the wormhole after touching Jonas.,"Helge Doppler (J), Jonas Kahnwald / Adam (J)"
,439,Jonas,12-11-1953,TRUE,FALSE,The time portal opens over Winden.,
,440,Jonas,12-11-2019,TRUE,FALSE,The time portal opens over Winden.,
,441,Jonas,12-11-2052,TRUE,FALSE,The time portal opens over Winden.,
,442,Jonas,11-11-2019,FALSE,FALSE,The stranger extracts a bit of substance from the radioactive waste in the truck.,Jonas Kahnwald / Adam (J)
,443,Jonas,22-06-1987,FALSE,FALSE,Old Claudia visits Adult Claudia at her office at the power plant and reveals her identity.,Claudia Tiedemann (J)
,444,Jonas,22-06-1987,FALSE,FALSE,Old Claudia shows Adult Claudia the time machine in the caves and tells her she must stop Adam.,Claudia Tiedemann (J)
,445,Jonas,22-06-1987,FALSE,FALSE,Old Egon visits adult Helge in the psychiatric hospital and asks him about Mads' disappearancet.,"Egon Tiedemann (J), Helge Doppler (J)"
,446,Jonas,22-06-1987,FALSE,FALSE,Old Egon first visits old Ulrich in the psych ward.,"Egon Tiedemann (J), Ulrich Nielsen (J)"
,447,Jonas,22-06-1987,FALSE,FALSE,Adult Claudia digs up the time machine that old Claudia had buried for her.,Claudia Tiedemann (J)
,448,Jonas,23-06-1987,FALSE,FALSE,Adult Claudia visits Old H.G. Tannhaus and he explains that A Journey Through Time traveled to him from the future before he wrote it.,"Claudia Tiedemann (J), H.G. Tannhaus"
,449,Jonas,23-06-1987,FALSE,FALSE,Old Egon visits adult Claudia at her office and tells her he has prostate cancer.,"Egon Tiedemann (J), Claudia Tiedemann (J)"
,450,Jonas,23-06-1987,FALSE,FALSE,Adult Claudia travels to 2020.,Claudia Tiedemann (J)
,451,Jonas,23-06-1987,FALSE,FALSE,Old Egon returns to old Ulrich and shows him Mikkel/Michael's photo.,"Egon Tiedemann (J), Ulrich Nielsen (J)"
,452,Jonas,23-06-1987,FALSE,FALSE,Adult Noah successfully transports child Helge to 1954 through the chair.,"Noah / Hanno Tauber (J), Helge Doppler (J)"
,453,Jonas,24-06-2020,FALSE,FALSE,Adult Claudia arrives from 1987 and learns adult Regina has cancer.,"Claudia Tiedemann (J), Regina Tiedemann (J)"
,454,Jonas,24-06-2020,FALSE,FALSE,"Adult Claudia goes to the library and researches her family, discovering Egon's impending death.",Claudia Tiedemann (J)
,455,Jonas,24-06-2020,FALSE,FALSE,Adult Claudia leaves to return to 1987.,Claudia Tiedemann (J)
,456,Jonas,24-06-1987,FALSE,FALSE,Adult Claudia returns from 2020.,Claudia Tiedemann (J)
,457,Jonas,25-06-1987,FALSE,FALSE,Adult Claudia asks old Egon to move in with her in the hopes of avoiding his death.,"Claudia Tiedemann (J), Egon Tiedemann (J)"
,458,Jonas,25-06-1987,FALSE,FALSE,Old Ulrich breaks out of the psychiatric hospital and finds Mikkel/Michael.,"Ulrich Nielsen (J), Mikkel Nielsen / Michael Kahnwald (J)"
,459,Jonas,25-06-1987,FALSE,FALSE,Old Egon and the police stop old Ulrich from taking Mikkel/Michael.,"Egon Tiedemann (J), Ulrich Nielsen (J), Mikkel Nielsen / Michael Kahnwald (J)"
,460,Jonas,25-06-1987,FALSE,FALSE,Old Ulrich sees the kids from inside the police car but is unable to make contact.,"Ulrich Nielsen (J), Magnus Nielsen (J), Franziska Doppler (J), Martha Nielsen (J), Bartosz Tiedemann (J), Elisabeth Doppler (J)"
,461,Jonas,25-06-1987,FALSE,FALSE,"Teen Magnus, teen Franziska, teen Martha, teen Bartosz, and child Elisabeth arrive from 2020.","Magnus Nielsen (J), Franziska Doppler (J), Martha Nielsen (J), Bartosz Tiedemann (J), Elisabeth Doppler (J)"
,462,Jonas,26-06-1987,FALSE,FALSE,Old Ulrich goes to the psych ward.,Ulrich Nielsen (J)
,463,Jonas,26-06-1987,FALSE,FALSE,"Old Egon wants to have the police search the caves, but adult Claudia refuses.","Egon Tiedemann (J), Claudia Tiedemann (J)"
,464,Jonas,26-06-1987,FALSE,TRUE,"When old Egon doesn't listen, they fight and he falls and hits his head.","Egon Tiedemann (J), Claudia Tiedemann (J)"
,465,Jonas,26-06-1987,TRUE,FALSE,"Adult Claudia decides to let old Egon die, thinking this is the sacrifice she needs to make to save Regina.","Egon Tiedemann (J), Claudia Tiedemann (J)"
,466,Jonas,26-06-1987,FALSE,FALSE,"Teen Jonas, after spending a year learning from old Claudia, arrives at adult Claudia's house and says she must come with him immediately.","Jonas Kahnwald / Adam (J), Claudia Tiedemann (J)"
,467,Jonas,27-06-1987,FALSE,FALSE,Teen Jonas brings adult Claudia to take an isotope from the waste in the caves.,"Jonas Kahnwald / Adam (J), Claudia Tiedemann (J)"
,468,Jonas,27-06-1987,FALSE,FALSE,Teen Jonas and adult Claudia use the time machine and reopen the passage.,"Jonas Kahnwald / Adam (J), Claudia Tiedemann (J)"
,469,Jonas,27-06-1987,FALSE,FALSE,Teen Jonas and adult Claudia leave for 2020.,"Jonas Kahnwald / Adam (J), Claudia Tiedemann (J)"
,470,Jonas,21-09-1987,FALSE,FALSE,The unknown break in Sic Mundus headquarters. they steal blueprints for the time machine before setting the room on fire.,Unknown
,471,Jonas,21-09-1987,FALSE,TRUE,Unknown trio kill Bernd Doppler to get the power plant's master key.,"Unknown, Bernd Doppler (J)"
,472,Jonas,22-09-1987,FALSE,TRUE,Unknown trio kill Claudia's secretary to get the power plant's blueprints.,Unknown
,473,Jonas,22-09-1987,FALSE,FALSE,Adult Katharina asks in the police station about Mikkel and they tell her that they took him to another place after an old man tried to take him again.,Katharina Nielsen (J)
,474,Jonas,22-09-1987,FALSE,FALSE,"Adult Katharina meets her mother, Helene Albers, at the pysch ward and ask her to visit the old man. ","Katharina Nielsen (J), Helene Albers (J)"
,475,Jonas,22-09-1987,FALSE,FALSE,Adult Katharina convinces Helene because Helene recognizes the Saint Christopher pendant.,"Katharina Nielsen (J), Helene Albers (J)"
,476,Jonas,22-09-1987,FALSE,FALSE,Adult Katharina meets old Ulrich and tell him that she is going to help him to escape.,"Katharina Nielsen (J), Ulrich Nielsen (J)"
,477,Jonas,22-09-1987,FALSE,FALSE,Adult Katharina rests in the Kahnwald's house. Adult Ines and Mikkel have been missing for 3 months.,Katharina Nielsen (J)
,478,Jonas,22-09-1987,FALSE,FALSE,"Adult Katharina visits the school looking for Mikkel. She meets teen Ulrich, teen Katharina and teen Hannah.","Katharina Nielsen (J), Ulrich Nielsen (J), Hannah Kahnwald (J)"
,479,Jonas,22-09-1987,FALSE,FALSE,Adult Jana is upset with adult Tronte because she knows that he was with Claudia the day that mads went missing.,"Jana Nielsen (J), Tronte Nielsen (J), Claudia Tiedemann (J)"
,480,Jonas,22-09-1987,FALSE,FALSE,Adult Tronte asks for Claudia at the power plant. Her secretary says Claudia looked weird a few days before her disappearance.,Tronte Nielsen (J)
,481,Jonas,25-09-1987,FALSE,FALSE,Adult Katharina plans to steal the pysch ward's keys from her mother and asks Ulrich to wait for her.,"Katharina Nielsen (J), Ulrich Nielsen (J)"
,482,Jonas,25-09-1987,FALSE,FALSE,Adult Katharina follow her mother and tries to steal the psych ward's keys.,"Katharina Nielsen (J), Helene Albers (J)"
,483,Jonas,25-09-1987,FALSE,TRUE,Adult Helene kills adult Katharina on the lake shore.,"Katharina Nielsen (J), Helene Albers (J)"
,484,Jonas,25-09-1987,FALSE,FALSE,The Saint Christopher pendant get lost in the sand.,
,485,Jonas,25-09-1987,FALSE,FALSE,Poor Ulrich stays alone in the pysch ward.,Ulrich Nielsen (J)
,486,Jonas,25-09-1987,FALSE,FALSE,Adult Ines and teen Michael come back to home.,"Ines Kahnwald (J), Mikkel Nielsen / Michael Kahnwald (J)"
,487,Jonas,25-09-1987,FALSE,FALSE,"Old H.G. Tannhaus shows to teen Charlotte a photo of his son, his son's wife and his granddaughter.","H.G. Tannhaus, Charlotte Doppler (J)"
,488,Jonas,25-09-1987,FALSE,FALSE,They had an accident and his son and his wife died. His granddaughter's body never appeared.,"H.G. Tannhaus, Charlotte Doppler (J)"
,489,Jonas,25-09-1987,FALSE,FALSE,"That day, two women handed H.G. Tannhaus a little Charlotte. She only carried a pocket watch with her name.","H.G. Tannhaus, Charlotte Doppler (J)"
,490,Jonas,25-09-1987,FALSE,FALSE,Teen peter arrives to Winden and teen Charlotte meets him.,"Charlotte Doppler (J), Peter Doppler (J)"
,491,Jonas,01-07-1953,TRUE,FALSE,Plans to build the power plant begin.,
,492,Jonas,05-11-1953,FALSE,FALSE,Erik's corpse appears in the bunker from 1986.,Erik Obendorf (J)
,493,Jonas,10-11-1953,FALSE,FALSE,The bodies of Erik and Yasin are found buried in a pile of sand in the nuclear plant.,Yasin Friese (J)
,494,Jonas,09-11-1953,FALSE,FALSE,Adult Helge disposes of Yasin's body.,"Helge Doppler (J), Yasin Friese (J)"
,495,Jonas,10-11-1953,FALSE,FALSE,Ulrich visits H.G. Tannhaus. child Jana and child Ines appear in the shop and talk about the bodies.,"Ulrich Nielsen (J), H.G. Tannhaus, Jana Nielsen (J), Ines Kahnwald (J)"
,496,Jonas,10-11-1953,FALSE,FALSE,Ulrich arrives from 2019.,Ulrich Nielsen (J)
,497,Jonas,10-11-1953,FALSE,FALSE,Ulrich met his grandmother Agnes and his father Tronte.,"Ulrich Nielsen (J), Agnes Nielsen (J), Tronte Nielsen (J)"
,498,Jonas,10-11-1953,FALSE,FALSE,Agnes and Tronte arrive to Winden.,"Agnes Nielsen (J), Tronte Nielsen (J)"
,499,Jonas,10-11-1953,FALSE,FALSE,Agnes and Tronte meet the Tiedemann's.,"Agnes Nielsen (J), Tronte Nielsen (J), Egon Tiedemann (J), Claudia Tiedemann (J), Doris Tiedemann (J)"
,500,Jonas,10-11-1953,FALSE,FALSE,Child Claudia teaches the town to Tronte. Helge accompanies them.,"Tronte Nielsen (J), Claudia Tiedemann (J), Helge Doppler (J), gretchen"
,501,Jonas,10-11-1953,FALSE,FALSE,Child Helge puts Gretchen in the cave.,"Helge Doppler (J), gretchen"
,502,Jonas,10-11-1953,FALSE,FALSE,Adult Ulrich leaves his phone at Adult H.G. Tannhaus' shop.,"Ulrich Nielsen (J), H.G. Tannhaus"
,503,Jonas,10-11-1953,FALSE,FALSE,Ulrich visits the police station and finds out that the little boy is Helge.,"Ulrich Nielsen (J), Helge Doppler (J), Egon Tiedemann (J)"
,504,Jonas,10-11-1953,TRUE,FALSE,Ulrich tries to kill little Helge so that he could prevent all the kids' murders.,"Ulrich Nielsen (J), Helge Doppler (J)"
,505,Jonas,11-11-1953,FALSE,FALSE,Adult Ulrich is arrested by adult Egon for Yasin and Erik's murders and the suspected murder of child Helge.,"Ulrich Nielsen (J), Egon Tiedemann (J)"
,506,Jonas,11-11-1953,FALSE,FALSE,Helge wakes up in the bunker.,Helge Doppler (J)
,507,Jonas,12-11-2019,FALSE,FALSE,Charlotte finds a 1953 newspaper article with a mugshot of Ulrich.,Charlotte Doppler (J)
,508,Jonas,11-11-1953,FALSE,FALSE,Claudia Tiedemann visits adult H.G. Tannhaus and asks him to build the time machine.,"H.G. Tannhaus, Claudia Tiedemann (J)"
,509,Jonas,12-11-1953,FALSE,FALSE,Child Helge goes to 1986 through the wormhole after touching Jonas.,"Jonas Kahnwald / Adam (J), Helge Doppler (J)"
,510,Jonas,23-06-1954,FALSE,FALSE,Adult Noah arrives from 1921.,Noah / Hanno Tauber (J)
,511,Jonas,23-06-1954,FALSE,FALSE,Agnes and Doris become lovers.,"Agnes Nielsen (J), Doris Tiedemann (J)"
,512,Jonas,23-06-1954,FALSE,FALSE,Daniel encourages Egon to have an affair.,"Egon Tiedemann (J), Daniel Kahnwald"
,513,Jonas,23-06-1954,FALSE,FALSE,Greta asks adult Noah to help with child Helge and gets him to speak.,"Greta Doppler (J), Helge Doppler (J), Noah / Hanno Tauber (J)"
,514,Jonas,23-06-1954,FALSE,FALSE,Child Helge returns home.,"Greta Doppler (J), Helge Doppler (J)"
,515,Jonas,23-06-1954,FALSE,FALSE,Adult Agnes tells adult Noah that old Claudia has the missing Triquetra pages on her.,"Agnes Nielsen (J), Noah / Hanno Tauber (J)"
